{"$schema":"https://json-schema.org/draft/2020-12/schema","type":"object","required":["audience","document_intent","surface_profile","primary_question","language"],"properties":{"audience":{"type":"string"},"document_intent":{"type":"string"},"surface_profile":{"type":"string"},"primary_question":{"type":"string"},"desired_action":{"type":"string"},"language":{"type":"object"},"technical_depth":{"type":"string"},"annex_policy":{"type":"string"}}}
