{"audience":"business owner","document_intent":"executive report","surface_profile":"omega-editorial","primary_question":"What should happen next?","desired_action":"approve review","language":{"primary":"ar","direction":"rtl","technical_english":"when_earned"},"technical_depth":"light","annex_policy":"technical details in annex"}
